MESSAGE,RESPONSE
How can I set a maximum amount per payment?,"In the Client Center, under ""Settings"" you can select the navigation item ""Payments"" to set your maximum payment amount."
How can I change or delete a payment? ,Payments entered in Online Banking can be modified or deleted directly in the “Administer payments” menu under “Payments overview”.
Up to what poin can I issue and change/delete a payment order in Online Banking?,Account transfers can be issued up to 21:00 on the day of execution free of charge. Payment orders can be issued up to 07:00 on the day of execution. Payment orders for single execution can be modified or deleted up until 24:00 on the day before execution.
How can I permanently change the account to be debited for payments?,Online Banking always takes the first account as the account to be debited for payment orders. You can choose a different account as the standard account to be debited for payment orders by going to “My Profile” and then “Settings” and “Payments”.
How do the payment templates work and how can I set them up?,"You can create a template for recurring payments with different amounts or payment dates. The easiest way is to save the beneficiary information when entering the first payment under “Single Payments”. Then select a folder from “Save as Template” before clicking on “Next”. You can save and manage these templates in folders you create yourself. You can then modify and
execute future payments simply by going to “Manage Payments” and “Templates/Lists”. The template is always stored under the beneficiary’s name."
Why am I unable to trade with one fund usuig Online Banking even though it is in my safekeeping account?,Regulatory reasons prevent us from offering and providing details of all funds on the internet. Please contact your Relationship Manager for additional information.
Where can I check the current value of my securities in Portfolio/Safekeeping Account?,"You get the most recent values by choosing ""Real-Time Positions"" and recalculating. The selected option is saved for future use per portfolio/safekeeping account. Depending on the security, the values shown are real-time, delayed, from the previous day, or older. You can see the source of the price and the appropriate delay by moving the mouse over the ""Last Price"" or ""Price"" field. The information is also available in the detailed pop-up window."
How can I print pages in Portfolio/Safekeeping Account?,"Use the PDF button, which you will find at the top and bottom of the page on the right-hand side. Depending on the asset classes in your safekeeping account, individual pages can contain a large amount of information. To allow you to print this as well, the information is displayed in a reduced print version. The ""Show All Details"" link takes you to the page with all the detailed information."
"How can I acces the portfolio, if I can only see the safekeeping account?","Please contact your Relationship Manager, who will be able to activate your authorization."
"What information can I find in the ""Maturity Analysis""?",The maturity analysis shows when the nominal assets are likely to mature. Maturities of more than or less than one year are differentiated. You can also see forecast income on this page (e.g. expected dividend payments).
"What information can I find in the ""Country Analysis""?",The country analysis shows the countries in which the portfolio/safekeeping account assets are invested.
"What information can I find under ""Sector Analysis""?",The sector analysis and analysis by debtor category also included on this page show the sectors in which the assets are invested and the debtor categories in which the nominal assets of the portfolio/safekeeping account are invested.
"What information can I find in ""Asset Allocation""?","""Asset Allocation"" shows the asset categories and currencies in which the portfolio assets or safekeeping account assets are invested."
What price is used to convert foreign currency positions?,"For valuation, either the current average exchange rate (real-time view) or the average exchange rate on the evening of the chosen valuation date is used."
Why do I sometimes see different account balances in Portfolio/Safekeeping Account and Account?,"The account balances in ""Portfolio"" show net information as of today/as of the record date. Bookings for future dates and provisional bookings are also included in the ""Account list"" and full overview. This can lead to different account balances appearing in different areas. However, it is easy to determine from the bookings in the appropriate account, which bookings are included in which account balance."
How can I order a statement of investments?,"Select the “Order Statement” tab under “Portfolio/Safekeeping Account”, and select the appropriate portfolio/safekeeping account. Confirm with “Go” and use the “Order” button to confirm the request. The ordered report will be sent by post or as an e-document, depending on mailing instructions."
What is the difference between a portfolo and safekeeping account?,"The portfolio shows both safekeeping account positions and the assigned accounts (including precious metals and money market accounts), forward transactions and options for precious metals and foreign exchange. The safekeeping account shows only positions with a “Security Number/ISIN”. Under “Portfolio/Safekeeping Account” you can choose whether you wish to see/analyze the full portfolio or just the safekeeping account positions. To do this, choose the option “Display safekeeping account positions only” and then recalculate. To make changes in the portfolio elements, please contact your relationship manager."
Can I include interest detail?,"You can make a request to your Relationship Manager, if you want interest details displayed. As soon as interest details are switched on for you, you can include these under “Accounts & Assets” in the account list by clicking on “Edit Table” and placing a tick next to interest in the pop-up window."
Why can I not see any details for incoming payments?,"If you find a booking with the text ""Payments"" and ""Global credit according to separate display"", your account is set up in such a way that bookings of the same type are summarized. If you want to change this and to have each credit booked separately (including the sender's details), please contact your Relationship Manager."
How can I export the bookings from a specific month to Excel?,"Select the required account, and choose ""Search Bookings"" in the left navigation menu. Then use the time period as the search parameter. When the results are displayed, click on the ""Export"" button under the bookings found."
export the bookings from a Excel?,"Select the desired account from the account list. Select ""Current month"" to the right above the displayed bookings, and click the ""GO"" button to confirm. Now you can scroll backward and forward by month under the displayed bookings. When the desired month is displayed, click on the ""Export"" link."
What are provisional bookings?,"Provisional bookings are advance notices of items which are not yet definitively booked and can therefore still be changed. However, since these provisional bookings also apply to the balance, provisional cash receipts can also be obtained at ATMs."
"Where can I find the IBAN, BIC/SWIFT, or clearing number for one of my accounts?","The IBAN is shown on all pages in the account area. The BIC is displayed in the upper section of each account details page. To display the clearing number, select ""Show All Details"" at the top of the account details pages."
"Which bookings can be seen under ""Booking entries - Account details""?","""Booking entries"" shows the bookings on your account. The default setting shows you the bookings for the last 30 days. You can also choose a different period or number of bookings on the bookings page itself. The selection is saved for later Online Banking sessions."
How can I save certain settings (grouping or period) for bookings as the default?,"The selected settings are automatically saved for the most important fields, and remain valid until you change them."